{
  "id":"ALC1737-var-0015",
  "sourceId":"ALC1737",
  "sourcePageDigital":114,
  "sourcePagePrinted":100,
  "section":"part_iv",
  "varietiesRaw":["Hiaqui"],
  "observationType":"lexical",
  "phenomenon":"forma histórica atribuida para 'hasta los huesos' en el tratamiento de venucutzi/patiua",
  "sourceText":"haſta los hueſſos, otampatiua, vel tutiua, dice el Hiaqui.",
  "structuredClaim":{"contextGlossRaw":"haſta los hueſſos","formsRaw":["otampatiua","tutiua"],"HiaquiAttributedFormRaw":"tutiua"},
  "editorialInterpretation":"La frase `dice el Hiaqui` atribuye explícitamente `tutiua` a Hiaqui en este contexto.",
  "caution":"La atribución se conserva en los términos históricos de la fuente y no se equipara automáticamente con una forma del yaqui contemporáneo.",
  "reviewStatus":"machine_corrected_unverified",
  "humanVerified":false,
  "provenance":{"derivedFrom":"ALC1737:digital-page-114;printed-page-100;rule-318","agent":"GPT-5.6 Sol visual collation","method":"Explicit historical variety attribution extracted from facsimile/transcription; no independent human verification","processedAt":null}
}