{
  "id":"ALC1737-var-0012",
  "sourceId":"ALC1737",
  "sourcePageDigital":73,
  "sourcePagePrinted":59,
  "section":"part_iii",
  "varietiesRaw":["Tehuecos","demás Naciones"],
  "observationType":"morphological",
  "phenomenon":"partículas optativas históricamente distribuidas por denominación de variedad",
  "sourceText":"Las notas, ó particulas optativas, que correſponden al utinam latino, y al ojala Eſpañol; ſon hau para los Tehuecos, y amatuc larga la penultima para las demás Naciones.",
  "structuredClaim":{"Tehuecos":{"optativeParticleRaw":"hau"},"otherNations":{"labelRaw":"demás Naciones","optativeParticleRaw":"amatuc","prosodicNoteRaw":"larga la penultima"}},
  "editorialInterpretation":"La regla 198 distribuye explícitamente dos notas optativas entre `Tehuecos` y el conjunto que el impreso denomina `las demás Naciones`.",
  "caution":"`demás Naciones`, `larga la penultima` y la oposición de partículas son categorías del testimonio de 1737; CHD no las convierte automáticamente en taxonomía dialectal ni análisis prosódico moderno.",
  "reviewStatus":"machine_corrected_unverified",
  "humanVerified":false,
  "provenance":{"derivedFrom":"ALC1737:digital-page-73;printed-page-59;rule-198","agent":"GPT-5.6 Sol visual collation","method":"Full-page visual collation against facsimile; no independent human verification","processedAt":null}
}
