{
  "id":"ALC1737-var-0016",
  "sourceId":"ALC1737",
  "sourcePageDigital":125,
  "sourcePagePrinted":111,
  "section":"part_iv",
  "varietiesRaw":["Hiaquis"],
  "observationType":"other_explicit_source_attribution",
  "phenomenon":"frecuencia atribuida de un adverbio temporal histórico",
  "sourceText":"Eſte ualiſi vſan mucho los Hiaquis.",
  "structuredClaim":{"formRaw":"ualiſi","sourceFrequencyRaw":"vſan mucho","attributedToRaw":"Hiaquis"},
  "editorialInterpretation":"La fuente atribuye explícitamente uso frecuente de la forma temporal `ualiſi` a los Hiaquis dentro del inventario `Temporis`.",
  "caution":"La forma exacta `ualiſi` requiere segunda colación; la atribución `vſan mucho los Hiaquis` es clara. CHD no convierte esta observación en frecuencia cuantitativa ni en dato del yaqui contemporáneo.",
  "reviewStatus":"unresolved",
  "humanVerified":false,
  "provenance":{"derivedFrom":"ALC1737:digital-page-125;printed-page-111;rule-345-continuation","agent":"GPT-5.6 Sol visual collation","method":"Explicit historical variety attribution extracted from facsimile/transcription; no independent human verification","processedAt":null}
}